{
  "period": "2026-W39",
  "resets_at": "2026-09-28T00:00:00+00:00",
  "runs": {
    "used": 12,
    "limit": 60,
    "by_you": 12,
    "by_bots": 0,
    "items": [
      {
        "key": "github:9919001#pr35",
        "surface": "github",
        "repository": "CodeBoarding/CodeBoarding",
        "pr": 35,
        "by": {
          "kind": "person",
          "login": "ivanmilevtues"
        },
        "first_run_at": "2026-09-23T11:02:00+00:00",
        "updates": 0
      },
      {
        "key": "github:9919001#pr34",
        "surface": "github",
        "repository": "CodeBoarding/CodeBoarding",
        "pr": 34,
        "by": {
          "kind": "person",
          "login": "ivanmilevtues"
        },
        "first_run_at": "2026-09-23T08:47:00+00:00",
        "updates": 4
      },
      {
        "key": "vscode:4d6f8a0c2e4f6a8b0c2d4e6f8a0b2c4d6e8f0a2b4c6d8e0f2a4b6c8d0e2f4a6b",
        "surface": "vscode",
        "repository": "CodeBoarding",
        "pr": null,
        "by": {
          "kind": "person",
          "login": "ivanmilevtues"
        },
        "first_run_at": "2026-09-22T09:30:00+00:00",
        "updates": 6
      }
    ]
  },
  "reviews": {
    "used": 9,
    "limit": 100,
    "items": [
      {
        "key": "github:9919001#pr35",
        "repository": "CodeBoarding/CodeBoarding",
        "pr": 35,
        "opened_at": "2026-09-23T11:20:00+00:00"
      }
    ]
  }
}
