{
  "period": "2026-W39",
  "resets_at": "2026-09-28T00:00:00+00:00",
  "runs": {
    "used": 7,
    "limit": 40,
    "by_you": 5,
    "by_bots": 2,
    "items": [
      {
        "key": "github:870011#pr2",
        "surface": "github",
        "repository": "Svilen-Stefanov/paywall-e2e",
        "pr": 2,
        "by": {
          "kind": "person",
          "login": "Svilen-Stefanov"
        },
        "first_run_at": "2026-09-22T16:40:00+00:00",
        "updates": 0
      },
      {
        "key": "github:870011#pr1",
        "surface": "github",
        "repository": "Svilen-Stefanov/paywall-e2e",
        "pr": 1,
        "by": {
          "kind": "person",
          "login": "Svilen-Stefanov"
        },
        "first_run_at": "2026-09-22T16:09:00+00:00",
        "updates": 1
      },
      {
        "key": "github:870011#pr4",
        "surface": "github",
        "repository": "Svilen-Stefanov/paywall-e2e",
        "pr": 4,
        "by": {
          "kind": "bot",
          "login": "dependabot[bot]"
        },
        "first_run_at": "2026-09-22T08:00:00+00:00",
        "updates": 0
      },
      {
        "key": "github:9919001#pr31",
        "surface": "github",
        "repository": "CodeBoarding/CodeBoarding",
        "pr": 31,
        "by": {
          "kind": "person",
          "login": "Svilen-Stefanov"
        },
        "first_run_at": "2026-09-21T15:20:00+00:00",
        "updates": 2
      },
      {
        "key": "github:9919002#run11809532110",
        "surface": "github",
        "repository": "CodeBoarding/CodeBoarding-action",
        "pr": null,
        "by": {
          "kind": "person",
          "login": "Svilen-Stefanov"
        },
        "first_run_at": "2026-09-21T11:30:00+00:00",
        "updates": 0
      },
      {
        "key": "vscode:9f2c4e1a7b3d5f60819a2b4c6d8e0f1a3b5c7d9e1f2a4b6c8d0e2f4a6b8c0d2e",
        "surface": "vscode",
        "repository": "CodeBoarding-webview",
        "pr": null,
        "by": {
          "kind": "person",
          "login": "Svilen-Stefanov"
        },
        "first_run_at": "2026-09-21T10:02:00+00:00",
        "updates": 3
      },
      {
        "key": "github:870011#pr3",
        "surface": "github",
        "repository": "Svilen-Stefanov/paywall-e2e",
        "pr": 3,
        "by": {
          "kind": "bot",
          "login": "dependabot[bot]"
        },
        "first_run_at": "2026-09-21T08:00:00+00:00",
        "updates": 0
      }
    ]
  },
  "reviews": {
    "used": 3,
    "limit": 60,
    "items": [
      {
        "key": "github:9919001#pr31",
        "repository": "CodeBoarding/CodeBoarding",
        "pr": 31,
        "opened_at": "2026-09-23T09:12:00+00:00"
      },
      {
        "key": "github:9919003#pr163",
        "repository": "CodeBoarding/CodeBoarding-webview",
        "pr": 163,
        "opened_at": "2026-09-22T14:30:00+00:00"
      },
      {
        "key": "github:9919001#pr28",
        "repository": "CodeBoarding/CodeBoarding",
        "pr": 28,
        "opened_at": "2026-09-21T17:45:00+00:00"
      }
    ]
  }
}
